Date and Time,SKU,Name,Brand,Average Rating,Rating Count,Sponsored,Price,Sales Price,Express,Rank,Link
2024-12-21 13:07:59,Z4247101839A17521A8B9Z,"Spall Yoga Mat Non Slip,Yoga Mat with Strap Included 10mm Thick Exercise Mat Yoga and Many Other Home Workouts ",Spall,5.0,5,N,80,42,Y,139,/uae-en/yoga-mat-non-slip-yoga-mat-with-strap-included-10mm-thick-exercise-mat-yoga-and-many-other-home-workouts/Z4247101839A17521A8B9Z/p/?o=z4247101839a17521a8b9z-1
2024-12-21 13:07:59,ZFC4F2BC1E9DC7B33305BZ,"Qiccijoo Qiccijoo Ankle Weights Set 1 Pair 4kg(8.8lb) Workout Ankle Weights for Women or Men Wrist Leg Weights for Fitness,Running,Walking,2*2kg(4.4lb) - Blue ",Qiccijoo,0,0,Y,89,89,Y,140,/uae-en/qiccijoo-ankle-weights-set-1-pair-4kg-8-8lb-workout-ankle-weights-for-women-or-men-wrist-leg-weights-for-fitness-running-walking-2-2kg-4-4lb-blue/ZFC4F2BC1E9DC7B33305BZ/p/?o=zfc4f2bc1e9dc7b33305bz-1
2024-12-21 13:07:59,Z3C8FFE396E1C4B2EFA2DZ,Generic Pilates Yoga Bed Yoga Studio Pilates Core Bed Pilates Training Bed Strength Adjustment Stainless Steel Yoga Training Bed ,Generic,0,0,Y,"2,500","1,969",Y,141,/uae-en/pilates-yoga-bed-yoga-studio-pilates-core-bed-pilates-training-bed-strength-adjustment-stainless-steel-yoga-training-bed/Z3C8FFE396E1C4B2EFA2DZ/p/?o=z3c8ffe396e1c4b2efa2dz-1
2024-12-21 13:07:59,Z603FF8FD1BFB572D8D9FZ,"URbazaar Yoga Mat for Women and Men, Extra Long and Wide Exercise Mat(72""x24""), Large Non Slip Workout Mat for Yoga, Pilates, Fitness, Barefoot Workouts, Home Gym Studio ",URbazaar,4.7,3,Y,69.90,50.90,Y,142,/uae-en/yoga-mat-for-women-and-men-extra-long-and-wide-exercise-mat-72-x24-large-non-slip-workout-mat-for-yoga-pilates-fitness-barefoot-workouts-home-gym-studio/Z603FF8FD1BFB572D8D9FZ/p/?o=z603ff8fd1bfb572d8d9fz-1
2024-12-21 13:07:59,ZA5E1BC7B9B0386840FA0Z,"BLOOMING TIME 5 Piece Fitness Yoga Mat Set, Home Exercise And Fitness Use, Purple ",BLOOMING,0,0,N,80,40.95,Y,143,/uae-en/5-piece-fitness-yoga-mat-set-home-exercise-and-fitness-use-purple/ZA5E1BC7B9B0386840FA0Z/p/?o=za5e1bc7b9b0386840fa0z-1
2024-12-21 13:07:59,Z24E1B5B4FDE8BB5C6111Z,"Bernessi 8MM Yoga Mat with Carrying Strap Anti-Slip for Home Workout Exercises Meditation Eco Friendly, Non Skid TPE Yoga Mattres for Pilates 183x61x0.8cm Thick, Pink/Black Color ",Bernessi,4.8,65,Y,165,69.90,Y,144,/uae-en/8mm-yoga-mat-with-carrying-strap-anti-slip-for-home-workout-exercises-meditation-eco-friendly-non-skid-tpe-yoga-mattres-for-pilates-183x61x0-8cm-thick-pink-black-color/Z24E1B5B4FDE8BB5C6111Z/p/?o=z24e1b5b4fde8bb5c6111z-1
2024-12-21 13:07:59,Z1A0EB1E6C4C1E349C57CZ,RIOXS 2 Pair Sandbag for Leg Weights and Wrist Weights with Adjustable Strap for Fitness Resistance Training Running Training Exercise Gym Running SandBag ,RIOXS,5.0,2,N,55,43.20,N,145,/uae-en/2-pair-sandbag-for-leg-weights-and-wrist-weights-with-adjustable-strap-for-fitness-resistance-training-running-training-exercise-gym-running-sandbag/Z1A0EB1E6C4C1E349C57CZ/p/?o=d843439836bf58ba
2024-12-21 13:07:59,Z0BBD9C7C83B7E8DF4FD6Z,"RIGID FITNESS Microfiber Gym Towel - Face Towel, Yoga Towel - Quick Dry & High Absorbent Sweat Towel For Gym Exercises and Outdoor - Thick 400Gsm - 75x35cm-Grey ",RIGID,4.1,20,N,45.75,45.75,N,146,/uae-en/microfiber-gym-towel-face-towel-yoga-towel-quick-dry-high-absorbent-sweat-towel-for-gym-exercises-and-outdoor-thick-400gsm-75x35cm-grey/Z0BBD9C7C83B7E8DF4FD6Z/p/?o=f433e986d29277cf
2024-12-21 13:07:59,Z3C8FFE396E1C4B2EFA2DZ,Generic Pilates Yoga Bed Yoga Studio Pilates Core Bed Pilates Training Bed Strength Adjustment Stainless Steel Yoga Training Bed ,Generic,0,0,Y,"2,500","1,969",Y,147,/uae-en/pilates-yoga-bed-yoga-studio-pilates-core-bed-pilates-training-bed-strength-adjustment-stainless-steel-yoga-training-bed/Z3C8FFE396E1C4B2EFA2DZ/p/?o=z3c8ffe396e1c4b2efa2dz-1
2024-12-21 13:07:59,ZACCFDDC3974DE78FE03AZ,ShebSheb Pilates Yoga Mat Thick Non Slip Exercise Mats 8mm TPE for Yoga Workout Pilates Yoga Mats for Women Men ,ShebSheb,4.5,11,N,59.90,59.90,Y,148,/uae-en/pilates-yoga-mat-thick-non-slip-exercise-mats-8mm-tpe-for-yoga-workout-pilates-yoga-mats-for-women-men/ZACCFDDC3974DE78FE03AZ/p/?o=zaccfddc3974de78fe03az-1
2024-12-21 13:07:59,Z689E2B8306771BEF21EEZ,"Align-Pilates Align-Pilates Extra Light Spring 47cm – Perfect for Reformer & Cadillac Workouts, Ideal for Gentle Resistance, Precision Training, Beginners & Rehabilitation ",Align-Pilates,0,0,N,200,170,Y,149,/uae-en/align-pilates-extra-light-spring-47cm-perfect-for-reformer-cadillac-workouts-ideal-for-gentle-resistance-precision-training-beginners-rehabilitation/Z689E2B8306771BEF21EEZ/p/?o=z689e2b8306771bef21eez-1
2024-12-21 13:07:59,N43426873A,Generic 184-Piece First Aid Set 21x15x5cm 21x15x5cm ,Generic,4.2,24,N,59,59,Y,150,/uae-en/184-piece-first-aid-set-21x15x5cm-21x15x5cm/N43426873A/p/?o=cef378dd08611fbd
2024-12-21 13:07:59,Z55690DC1CB6C6548422FZ,Gaiam On-The-Go Yoga Mat Carrier ,Gaiam,5.0,1,N,129,62,Y,151,/uae-en/on-the-go-yoga-mat-carrier/Z55690DC1CB6C6548422FZ/p/?o=z55690dc1cb6c6548422fz-1
2024-12-21 13:07:59,ZF2AD343BBA1053AD5D63Z,"RIOXS Yoga Pilates Kits-Non slip Yoga Mat + 5 Pcs Resistance Band,Sports Fitness Gym Strength Training,Rubber Loops Elastic Bands,Fitness Yoga Exercise Pull Rope Mat ",RIOXS,5.0,2,N,89,69,Y,152,/uae-en/yoga-pilates-kits-non-slip-yoga-mat-5-pcs-resistance-band-sports-fitness-gym-strength-training-rubber-loops-elastic-bands-fitness-yoga-exercise-pull-rope-mat/ZF2AD343BBA1053AD5D63Z/p/?o=zf2ad343bba1053ad5d63z-1
2024-12-21 13:07:59,Z05FE5A0BC4B4236024FCZ,"WENBO Yoga Foam Roller Self Massage Exercise, Back, Leg, Body Starching Physical Therapy (33cm L) (Pink) ",WENBO,0,0,Y,49,45,Y,153,/uae-en/yoga-foam-roller-self-massage-exercise-back-leg-body-starching-physical-therapy-33cm-l-pink/Z05FE5A0BC4B4236024FCZ/p/?o=z05fe5a0bc4b4236024fcz-4
2024-12-21 13:07:59,Z17396F3BAD9F89F82C7CZ,"GGEROU Minimalist barefoot sock shoes for women and men,Non-Slip Beach Shoes Fitness Sports Shoe ",GGEROU,0,0,N,77.35,62.50,Y,154,/uae-en/minimalist-barefoot-sock-shoes-for-women-and-men-non-slip-beach-shoes-fitness-sports-shoe/Z17396F3BAD9F89F82C7CZ/p/?o=z17396f3bad9f89f82c7cz-1
2024-12-21 13:07:59,Z7E9451BC8DAFD1D2386DZ,Prickly Pear Prickly Pear Non-Slip Suede Top 1mm Travel Yoga Mat - Ideal for Travel Workouts ,Prickly,0,0,N,240,160,Y,155,/uae-en/prickly-pear-non-slip-suede-top-1mm-travel-yoga-mat-ideal-for-travel-workouts/Z7E9451BC8DAFD1D2386DZ/p/?o=z7e9451bc8dafd1d2386dz-1
2024-12-21 13:07:59,ZAE8C2CF4AD119E9007A2Z,Generic COOLBABY Pilates Yoga Wedge Massage Correction Yoga Foam Kyphosis Correction Detachable Large Spine Yoga Equipment ,Generic,0,0,N,299,269.10,Y,156,/uae-en/coolbaby-pilates-yoga-wedge-massage-correction-yoga-foam-kyphosis-correction-detachable-large-spine-yoga-equipment/ZAE8C2CF4AD119E9007A2Z/p/?o=zae8c2cf4ad119e9007a2z-1
2024-12-21 13:07:59,Z538D19FE4FEBB09B4BC8Z,"GROIC Yoga Mat Tote Bag, Yoga Canvas Workout Bag with Yoga Mat Carrier Binding Rope,Canvas Yoga Bag,Gym Bag with Yoga Mat Holder ",GROIC,5.0,2,N,200,62.35,Y,157,/uae-en/yoga-mat-tote-bag-yoga-canvas-workout-bag-with-yoga-mat-carrier-binding-rope-canvas-yoga-bag-gym-bag-with-yoga-mat-holder/Z538D19FE4FEBB09B4BC8Z/p/?o=z538d19fe4febb09b4bc8z-1
2024-12-21 13:07:59,Z603FF8FD1BFB572D8D9FZ,"URbazaar Yoga Mat for Women and Men, Extra Long and Wide Exercise Mat(72""x24""), Large Non Slip Workout Mat for Yoga, Pilates, Fitness, Barefoot Workouts, Home Gym Studio ",URbazaar,4.7,3,Y,69.90,50.90,Y,158,/uae-en/yoga-mat-for-women-and-men-extra-long-and-wide-exercise-mat-72-x24-large-non-slip-workout-mat-for-yoga-pilates-fitness-barefoot-workouts-home-gym-studio/Z603FF8FD1BFB572D8D9FZ/p/?o=z603ff8fd1bfb572d8d9fz-1
2024-12-21 13:07:59,N52165260A,BODY SCULPTURE Interlocking Mat 60 x 60cm ,BODY,5.0,3,N,103,84,Y,159,/uae-en/interlocking-mat-60-x-60cm/N52165260A/p/?o=c677ac730516096b
2024-12-21 13:07:59,Z3506D8963D73D684143DZ,RATSAW Aerial Yoga Strap Aerial Silk Fabric Yoga Swing Yoga Hammock for Antigravity Yoga Inversion Yoga Stretching Strap and Home Equipment for Ballet and Dance ,RATSAW,5.0,2,N,169,58,Y,160,/uae-en/aerial-yoga-strap-aerial-silk-fabric-yoga-swing-yoga-hammock-for-antigravity-yoga-inversion-yoga-stretching-strap-and-home-equipment-for-ballet-and-dance/Z3506D8963D73D684143DZ/p/?o=z3506d8963d73d684143dz-1
2024-12-21 13:07:59,N11005258A,BODY SCULPTURE Yoga And Exercise Mat With Strap 6ml ,BODY,4.7,5,N,79,32,Y,161,/uae-en/yoga-and-exercise-mat-with-strap-6ml/N11005258A/p/?o=fc937d235888d83b
2024-12-21 13:07:59,ZFF6D1886AAD421874DF1Z,Toshionics Anti Slip Fitness Exercise Gym Yoga Mats 4mm Thick For indoor And Outdoor 61x173cm Multicolor ,Toshionics,3.7,3,Y,60,31.75,Y,162,/uae-en/anti-slip-fitness-exercise-gym-yoga-mats-4mm-thick-for-indoor-and-outdoor-61x173cm-multicolor/ZFF6D1886AAD421874DF1Z/p/?o=zff6d1886aad421874df1z-1
2024-12-21 13:07:59,ZD5319B6FE6A3815BBE65Z,Cool Baby Style Pilates Reformer Pilates Dirac Loft Bed Yoga Bed Home Commercial Fitness Equipment ,Cool,0,0,Y,"4,999","4,299",Y,163,/uae-en/pilates-reformer-pilates-dirac-loft-bed-yoga-bed-home-commercial-fitness-equipment/ZD5319B6FE6A3815BBE65Z/p/?o=zd5319b6fe6a3815bbe65z-1
2024-12-21 13:07:59,ZA20A29558D85EF0EDB9EZ,"Longchamp Longchamp women's large tote bag, handbag, shoulder bag, navy blue classic style Topic: ",Longchamp,0,0,Y,399.90,156.85,Y,164,/uae-en/longchamp-women-s-large-tote-bag-handbag-shoulder-bag-navy-blue-classic-style-topic/ZA20A29558D85EF0EDB9EZ/p/?o=za20a29558d85ef0edb9ez-1
2024-12-21 13:07:59,N34152615A,Generic 2-Piece Yoga Brick Block Set ,Generic,4.7,14,N,31.45,27.40,Y,165,/uae-en/2-piece-yoga-brick-block-set/N34152615A/p/?o=b02f5b68f15dd05a
2024-12-21 13:07:59,Z947B82A9BF51AC1497E7Z,"Manduka Align Yoga Strap | Lightweight Cotton | Secure, Slip-Free Support | 1.75 Inch Wide | Available in Various Sizes & Colors ",Manduka,0,0,N,126,115,Y,166,/uae-en/align-yoga-strap-lightweight-cotton-secure-slip-free-support-1-75-inch-wide-available-in-various-sizes-colors/Z947B82A9BF51AC1497E7Z/p/?o=z947b82a9bf51ac1497e7z-1
2024-12-21 13:07:59,ZFACBB4361E1C8D65E262Z,Reebok Training Mat - 10Mm - Red ,Reebok,0,0,N,135,91,Y,167,/uae-en/training-mat-10mm-red/ZFACBB4361E1C8D65E262Z/p/?o=zfacbb4361e1c8d65e262z-1
2024-12-21 13:07:59,ZC7C1017CDFCAC890274CZ,MahMir MahMir Yoga Mat Anti-Slip Exercise Mat with Carrying Bag Fitness Mat for Pilates 183CM*61CM*6MM Thickness for Woman Man Beginners  Light Green+Black ,MahMir,4.3,27,N,69.95,49.95,Y,168,/uae-en/mahmir-yoga-mat-anti-slip-exercise-mat-with-carrying-bag-fitness-mat-for-pilates-183cm-61cm-6mm-thickness-for-woman-man-beginners-light-green-black/ZC7C1017CDFCAC890274CZ/p/?o=zc7c1017cdfcac890274cz-1
2024-12-21 13:07:59,ZE94894E319EC24478F43Z,"Longchamp Longchamp women's large tote bag, handbag, shoulder bag black classic style ",Longchamp,0,0,N,399.90,156.85,Y,169,/uae-en/longchamp-women-s-large-tote-bag-handbag-shoulder-bag-black-classic-style/ZE94894E319EC24478F43Z/p/?o=ze94894e319ec24478f43z-1
2024-12-21 13:07:59,Z2608941456AA02760444Z,"GGEROU Minimalist barefoot sock shoes for women and men,Non-Slip Beach Shoes Fitness Sports Shoe ",GGEROU,0,0,N,77.35,62.50,Y,170,/uae-en/minimalist-barefoot-sock-shoes-for-women-and-men-non-slip-beach-shoes-fitness-sports-shoe/Z2608941456AA02760444Z/p/?o=z2608941456aa02760444z-1
2024-12-21 13:07:59,Z15AAECE2FF51FE1B04EEZ,Eworld Anti-slip Yoga Mat With Carrying Strap For Home And Gym ,Eworld,0,0,N,34.95,34.95,Y,171,/uae-en/anti-slip-yoga-mat-with-carrying-strap-for-home-and-gym/Z15AAECE2FF51FE1B04EEZ/p/?o=z15aaece2ff51fe1b04eez-1
2024-12-21 13:07:59,Z803968E97E86E5DA8974Z,"Generic Non Slip Socks for Women, All Season Fashion, Simple Casual Sports Socks,  Yoga, Ballet, Dance, Fitness, Football, Hospital, Medium Size Socks, Free Size 2pcs ",Generic,5.0,1,N,41.80,31.80,Y,172,/uae-en/non-slip-socks-for-women-all-season-fashion-simple-casual-sports-socks-yoga-ballet-dance-fitness-football-hospital-medium-size-socks-free-size-2pcs/Z803968E97E86E5DA8974Z/p/?o=z803968e97e86e5da8974z-1
2024-12-21 13:07:59,ZA4D68DC410E6B28CE258Z,"ZCM-HAPPY Yoga Mat with Straps, Non-Slip TPE Pilates Fitness Mat for Home Exercise and Meditation 183x61x0.6cm ",ZCM-HAPPY,0,0,N,44,44,Y,173,/uae-en/yoga-mat-with-straps-non-slip-tpe-pilates-fitness-mat-for-home-exercise-and-meditation-183x61x0-6cm/ZA4D68DC410E6B28CE258Z/p/?o=za4d68dc410e6b28ce258z-1
2024-12-21 13:07:59,ZA3EF4D0BF060CAC7F4CDZ,"Spall Yoga Mat Non Slip,Yoga Mat with Strap Included 10mm Thick Exercise Mat Yoga and Many Other Home Workouts ",Spall,5.0,1,N,80,42,Y,174,/uae-en/yoga-mat-non-slip-yoga-mat-with-strap-included-10mm-thick-exercise-mat-yoga-and-many-other-home-workouts/ZA3EF4D0BF060CAC7F4CDZ/p/?o=za3ef4d0bf060cac7f4cdz-1
2024-12-21 13:07:59,N16529622A,body heart Yoga Ball With Air Pump - 75 cm 75cm 75cm ,body,0,0,N,38.15,27.25,N,175,/uae-en/yoga-ball-with-air-pump-75-cm-75cm-75cm/N16529622A/p/?o=eebbb29e4105533f
2024-12-21 13:07:59,N33573074A,Generic EVA Yoga Foam Massage Roller ,Generic,4.5,15,N,103.75,33.85,Y,176,/uae-en/eva-yoga-foam-massage-roller/N33573074A/p/?o=c9d5f6febb9074af
2024-12-21 13:07:59,ZB78840EF57490BD48D7BZ,Generic Round Massager Roller For Waist Abdominal Muscles Ring Leg Clip Stovepipe To Clear The Meridian Portable Cellulite Massage ,Generic,0,0,N,140,140,Y,177,/uae-en/round-massager-roller-for-waist-abdominal-muscles-ring-leg-clip-stovepipe-to-clear-the-meridian-portable-cellulite-massage/ZB78840EF57490BD48D7BZ/p/?o=zb78840ef57490bd48d7bz-1
2024-12-21 13:07:59,ZA05E7D54EF2EA1894D67Z,COSCO Pack Of Two Premium Yoga Exercise Mats With Smart Carry Bags In Green And Violet Colours ,COSCO,0,0,N,140,56,Y,178,/uae-en/pack-of-two-premium-yoga-exercise-mats-with-smart-carry-bags-in-green-and-violet-colours/ZA05E7D54EF2EA1894D67Z/p/?o=za05e7d54ef2ea1894d67z-1
2024-12-21 13:07:59,Z719A382A1CA26C55AB50Z,ALSAQER Alsaqer Traditional Arabic Outdoor Carpet | Arabic Sadu Mat Foldable (1.8x2.5 Mtr) Majlis Mat|Majlis Carpet | Outdoor Camping Mat|Camping Carpet|Majlis Mat|Sadu Carpet|Picnic Mat Multicolour ,ALSAQER,0,0,N,59.95,49.95,Y,179,/uae-en/alsaqer-traditional-arabic-outdoor-carpet-arabic-sadu-mat-foldable-1-8x2-5-mtr-majlis-mat-majlis-carpet-outdoor-camping-mat-camping-carpet-majlis-mat-sadu-carpet-picnic-mat-multicolour/Z719A382A1CA26C55AB50Z/p/?o=z719a382a1ca26c55ab50z-1
2024-12-21 13:07:59,Z24E1B5B4FDE8BB5C6111Z,"Bernessi 8MM Yoga Mat with Carrying Strap Anti-Slip for Home Workout Exercises Meditation Eco Friendly, Non Skid TPE Yoga Mattres for Pilates 183x61x0.8cm Thick, Pink/Black Color ",Bernessi,4.8,65,Y,165,69.90,Y,180,/uae-en/8mm-yoga-mat-with-carrying-strap-anti-slip-for-home-workout-exercises-meditation-eco-friendly-non-skid-tpe-yoga-mattres-for-pilates-183x61x0-8cm-thick-pink-black-color/Z24E1B5B4FDE8BB5C6111Z/p/?o=z24e1b5b4fde8bb5c6111z-1
2024-12-21 13:07:59,Z6D2D9E0F1FF6C46DE776Z,"ZCM-HAPPY Yoga Mat with Straps, Non-Slip TPE Pilates Fitness Mat for Home Exercise and Meditation 183x61x0.6cm ",ZCM-HAPPY,5.0,1,N,44,44,Y,181,/uae-en/yoga-mat-with-straps-non-slip-tpe-pilates-fitness-mat-for-home-exercise-and-meditation-183x61x0-6cm/Z6D2D9E0F1FF6C46DE776Z/p/?o=z6d2d9e0f1ff6c46de776z-1
2024-12-21 13:07:59,ZB632C9DAF2781BC9181BZ,Depend Non Slip Socks Women Fashion All Season Socks Sports Casual Simple Striped Colors for Pilates Yoga Barre Ballet Dance Fitness Football Hospital Mid-Tube Socks Free Size 3-Pair ,Depend,5.0,1,N,75,53.55,Y,182,/uae-en/non-slip-socks-women-fashion-all-season-socks-sports-casual-simple-striped-colors-for-pilates-yoga-barre-ballet-dance-fitness-football-hospital-mid-tube-socks-free-size-3-pair/ZB632C9DAF2781BC9181BZ/p/?o=zb632c9daf2781bc9181bz-1
2024-12-21 13:07:59,Z38732CAF786555E0B356Z,Depend Non Slip Socks Women Fashion All Season Socks Sports Casual Simple Striped Colors for Pilates Yoga Barre Ballet Dance Fitness Football Hospital Mid-Tube Socks Free Size 3-Pair ,Depend,0,0,N,75,56.85,Y,183,/uae-en/non-slip-socks-women-fashion-all-season-socks-sports-casual-simple-striped-colors-for-pilates-yoga-barre-ballet-dance-fitness-football-hospital-mid-tube-socks-free-size-3-pair/Z38732CAF786555E0B356Z/p/?o=z38732caf786555e0b356z-1
2024-12-21 13:07:59,ZEA24FB40EFA91537125FZ,Adidas Fitness Mat - 10Mm - Solar Red ,Adidas,0,0,N,195,132,Y,184,/uae-en/fitness-mat-10mm-solar-red/ZEA24FB40EFA91537125FZ/p/?o=zea24fb40efa91537125fz-1
2024-12-21 13:07:59,Z1E54BEB86583EFE979F7Z,"GROIC Yoga Mat Bag with Large Size Pocket，Multipurpose and Beautiful Bag,Yoga Mat Carrier Tote, Holds More Yoga Accessories ",GROIC,5.0,1,N,200,76.35,Y,185,/uae-en/yoga-mat-bag-with-large-size-pocket-multipurpose-and-beautiful-bag-yoga-mat-carrier-tote-holds-more-yoga-accessories/Z1E54BEB86583EFE979F7Z/p/?o=z1e54beb86583efe979f7z-1
2024-12-21 13:07:59,ZE9C4E16611A06CD85CFEZ,"KETTLER Premium German Technology Powered Grey 8 mm TPE Yoga Mat for Workout Yoga Fitness Pilates and Meditation High-Density Anti-Tear & Anti-Tear, Ideal for Men & Women with Carry Bag (Grey) ",KETTLER,5.0,1,N,99,49,Y,186,/uae-en/premium-german-technology-powered-grey-8-mm-tpe-yoga-mat-for-workout-yoga-fitness-pilates-and-meditation-high-density-anti-tear-anti-tear-ideal-for-men-women-with-carry-bag-grey/ZE9C4E16611A06CD85CFEZ/p/?o=ze9c4e16611a06cd85cfez-1
2024-12-21 13:07:59,N43318329A,Rock Pow 4-Speed Electric Vibration Massager Foam Roller 12.2 x 6inch ,Rock,5.0,5,N,98.95,87.40,Y,187,/uae-en/4-speed-electric-vibration-massager-foam-roller-12-2-x-6inch/N43318329A/p/?o=d4082700b720061e
2024-12-21 13:07:59,Z991CC14F2ECFA183A322Z,BalanceFrom BalanceFrom GoCloud All Purpose 1 Inch Extra Thick High Density Anti Tear Exercise Yoga Mat with Carrying Strap Gray ,BalanceFrom,0,0,N,350,80,Y,188,/uae-en/balancefrom-gocloud-all-purpose-1-inch-extra-thick-high-density-anti-tear-exercise-yoga-mat-with-carrying-strap-gray/Z991CC14F2ECFA183A322Z/p/?o=z991cc14f2ecfa183a322z-1
2024-12-21 13:07:59,Z32CADD1858C6D6393BC3Z,"Eworld Anti-slip Yoga Sports and Exercise Mat with Carrying Strap Water Repellent Moisture Proof for Home and Gym, Grey ",Eworld,0,0,Y,34.95,34.95,Y,189,/uae-en/anti-slip-yoga-sports-and-exercise-mat-with-carrying-strap-water-repellent-moisture-proof-for-home-and-gym-grey/Z32CADD1858C6D6393BC3Z/p/?o=z32cadd1858c6d6393bc3z-1
2024-12-21 13:07:59,Z2F9046D53376D3F6A8B7Z,YQbest Yoga Barre Socks Non Slip Anti Skid Sticky Silicone Grips Cotton for Pilates Gym Pure Ballet Dance Barefoot Workout Ankle Multiuse Black Grey Skin Color 3Pcs ,YQbest,0,0,Y,69,48,Y,190,/uae-en/yoga-barre-socks-non-slip-anti-skid-sticky-silicone-grips-cotton-for-pilates-gym-pure-ballet-dance-barefoot-workout-ankle-multiuse-black-grey-skin-color-3pcs/Z2F9046D53376D3F6A8B7Z/p/?o=z2f9046d53376d3f6a8b7z-1
2024-12-21 13:07:59,Z576A0EBA8EADCC851199Z,"RIGID FITNESS Yoga Mat 6mm with Alignments - Anti-Slip TPE Yoga Mat with Carry Bag - Precision Alignment Lines, Double Colors, Lightweight & Durable for All Fitness Exercises- 183 * 66cm*0.6cm Thick ",RIGID,4.8,28,N,96,75.85,Y,191,/uae-en/yoga-mat-6mm-with-alignments-anti-slip-tpe-yoga-mat-with-carry-bag-precision-alignment-lines-double-colors-lightweight-durable-for-all-fitness-exercises-183-66cm-0-6cm-thick/Z576A0EBA8EADCC851199Z/p/?o=z576a0eba8eadcc851199z-1
2024-12-21 13:07:59,ZE5D7520215AA49D4ED49Z,"TYCOM Tycom Resistance Loop Bands- Resistance Exercise Bands Set Workout Bands Flex bands for Home Fitness, Stretching, Strength Training, Physical Therapy, Yoga ",TYCOM,5.0,3,Y,49,28.60,Y,192,/uae-en/tycom-resistance-loop-bands-resistance-exercise-bands-set-workout-bands-flex-bands-for-home-fitness-stretching-strength-training-physical-therapy-yoga/ZE5D7520215AA49D4ED49Z/p/?o=ze5d7520215aa49d4ed49z-1
2024-12-21 13:07:59,N30517442A,Generic Yoga Mat ,Generic,4.4,68,N,35,22.15,Y,193,/uae-en/yoga-mat/N30517442A/p/?o=db101162ddaf813a
2024-12-21 13:07:59,Z986AF669ECA902372325Z,Generic The World's Best Eco Friendly Non Slip Yoga Mat With The ORIGINAL Unique Alignment Marker System Biodegradable Mat Made With Natural Rubber  A Warrior Like Grip 183*68*0.5cm ,Generic,0,0,N,179,179,Y,194,/uae-en/the-world-s-best-eco-friendly-non-slip-yoga-mat-with-the-original-unique-alignment-marker-system-biodegradable-mat-made-with-natural-rubber-a-warrior-like-grip-183-68-0-5cm/Z986AF669ECA902372325Z/p/?o=z986af669eca902372325z-1
2024-12-21 13:07:59,Z1FFBA90CF03B4E1CDF5CZ,"MahMir Mahmir® EVA Foam Roller for Yoga, Deep Tissue Massage, Stretching, Physical Therapy, Relieve Stress, Improve Mobility with Foam Roller for Legs and Muscles - Deep Tissue Massage Tool (Light Blue) ",MahMir,3.4,3,Y,29.95,29.95,Y,195,/uae-en/mahmir-eva-foam-roller-for-yoga-deep-tissue-massage-stretching-physical-therapy-relieve-stress-improve-mobility-with-foam-roller-for-legs-and-muscles-deep-tissue-massage-tool-light-blue/Z1FFBA90CF03B4E1CDF5CZ/p/?o=z1ffba90cf03b4e1cdf5cz-1
2024-12-21 13:07:59,ZE94894E319EC24478F43Z,"Longchamp Longchamp women's large tote bag, handbag, shoulder bag black classic style ",Longchamp,0,0,Y,399.90,156.85,Y,196,/uae-en/longchamp-women-s-large-tote-bag-handbag-shoulder-bag-black-classic-style/ZE94894E319EC24478F43Z/p/?o=ze94894e319ec24478f43z-1
2024-12-21 13:07:59,Z549615CC1C4033D14D98Z,"NNEWVANTE Nnewvante Silk Sleep Mask, 2 Pack 100% Real Natural Pure Silk Eye Mask with Adjustable Strap, Eye Mask for Sleeping, Eye Sleep Shade Cover, Blocks Light Reduces Puffy Eyes Gifts ",NNEWVANTE,3.5,5,Y,35.95,23.90,Y,197,/uae-en/nnewvante-silk-sleep-mask-2-pack-100-real-natural-pure-silk-eye-mask-with-adjustable-strap-eye-mask-for-sleeping-eye-sleep-shade-cover-blocks-light-reduces-puffy-eyes-gifts/Z549615CC1C4033D14D98Z/p/?o=z549615cc1c4033d14d98z-1
2024-12-21 13:07:59,N40965360A,FORCE 24 Pro Grip Yoga Mat 183cm ,FORCE,4.8,4,N,99,59.90,Y,198,/uae-en/pro-grip-yoga-mat-183cm/N40965360A/p/?o=a54d700540b2f8da
2024-12-21 13:07:59,N37816362A,Generic Breathable Yoga Mat Mesh Bag 11.8x27.5inch ,Generic,3.6,80,N,33,19.85,Y,199,/uae-en/breathable-yoga-mat-mesh-bag-11-8x27-5inch/N37816362A/p/?o=a59e701361a07a7a
2024-12-21 13:07:59,Z07636371645FF3844EEAZ,Made2Motivate Sensory Compression Swing for Kids with Special Needs | Sensory Compression Swing - A Therapeutic and Calming Solution for Sensory Processing Disorder ,Made2Motivate,0,0,N,250,250,Y,200,/uae-en/sensory-compression-swing-for-kids-with-special-needs-sensory-compression-swing-a-therapeutic-and-calming-solution-for-sensory-processing-disorder/Z07636371645FF3844EEAZ/p/?o=z07636371645ff3844eeaz-1
2024-12-21 13:07:59,N28558670A,TOEON Muscle Massage Stick Roller 16.8x1.5x1.5inch ,TOEON,4.3,11,N,32.10,24.65,Y,201,/uae-en/muscle-massage-stick-roller-16-8x1-5x1-5inch/N28558670A/p/?o=c7b924ac36c6156c
2024-12-21 13:07:59,ZE9BC56837C893BAD2931Z,"RIGID FITNESS Thick Yoga Mat 8mm - Knees Supportive Exercise Mat - for Yoga, Pilates, Fitness Exercises and Home Exercise Fitness Mat - Non-Slip Yoga Gym Mat With Carrying Bag - 183*66cm (Gold/Black) ",RIGID,4.7,60,N,130.25,95.75,Y,202,/uae-en/thick-yoga-mat-8mm-knees-supportive-exercise-mat-for-yoga-pilates-fitness-exercises-and-home-exercise-fitness-mat-non-slip-yoga-gym-mat-with-carrying-bag-183-66cm-gold-black/ZE9BC56837C893BAD2931Z/p/?o=ze9bc56837c893bad2931z-1
2024-12-21 13:07:59,ZD662F27EA6FC5953FC16Z,Gaiam Marrakesh Yoga Mat 4mm ,Gaiam,0,0,N,165,91,Y,203,/uae-en/marrakesh-yoga-mat-4mm/ZD662F27EA6FC5953FC16Z/p/?o=zd662f27ea6fc5953fc16z-1
2024-12-21 13:07:59,Z3C8DAF40330507AC95A4Z,LACOSTE Lacoste Tote Bag Large Size Black Color ,LACOSTE,0,0,Y,299,152.75,Y,204,/uae-en/lacoste-tote-bag-large-size-black-color/Z3C8DAF40330507AC95A4Z/p/?o=z3c8daf40330507ac95a4z-1
2024-12-21 13:07:59,Z30868C98E61D2ABA2621Z,"MahMir Mahmir® EVA Foam Roller for Yoga, Deep Tissue Massage, Stretching, Physical Therapy, Relieve Stress, Improve Mobility with Foam Roller for Legs and Muscles - Deep Tissue Massage Tool (Pink) ",MahMir,4.0,8,Y,29.95,29.95,Y,205,/uae-en/mahmir-eva-foam-roller-for-yoga-deep-tissue-massage-stretching-physical-therapy-relieve-stress-improve-mobility-with-foam-roller-for-legs-and-muscles-deep-tissue-massage-tool-pink/Z30868C98E61D2ABA2621Z/p/?o=z30868c98e61d2aba2621z-1
2024-12-21 13:07:59,ZA851767ED9D0B9CD5A85Z,"ZCM-HAPPY Yoga Mat with Straps, Non-Slip TPE Pilates Fitness Mat for Home Exercise and Meditation 183x61x0.6cm ",ZCM-HAPPY,0,0,N,44,44,Y,206,/uae-en/yoga-mat-with-straps-non-slip-tpe-pilates-fitness-mat-for-home-exercise-and-meditation-183x61x0-6cm/ZA851767ED9D0B9CD5A85Z/p/?o=za851767ed9d0b9cd5a85z-1
2024-12-21 13:07:59,ZB6E61CE23B29DAF85955Z,"MahMir MahMir® Yoga Cork Block – Supportive, Sustainable Cork with Non-Slip Surface, Exercise Accessory for Yoga, Pilates, and General Fitness, Natural Cork Blocks Size 9""x6""x3"" (2pcs pack) ",MahMir,4.7,4,N,69.95,59.95,N,207,/uae-en/mahmir-yoga-cork-block-supportive-sustainable-cork-with-non-slip-surface-exercise-accessory-for-yoga-pilates-and-general-fitness-natural-cork-blocks-size-9-x6-x3-2pcs-pack/ZB6E61CE23B29DAF85955Z/p/?o=fae71ce02e9b7d0e
2024-12-21 13:07:59,Z9387DF38B9F416BA232BZ,"Tchibo Mat Carrying Strap, Black ",Tchibo,0,0,N,84.35,33.35,Y,208,/uae-en/mat-carrying-strap-black/Z9387DF38B9F416BA232BZ/p/?o=z9387df38b9f416ba232bz-1
2024-12-21 13:07:59,Z4F92579021C1CA25613BZ,Align-Pilates Align-Pilates Leg Extensions for R8-Pro Pilates Reformer ,Align-Pilates,0,0,Y,250,230,Y,209,/uae-en/align-pilates-leg-extensions-for-r8-pro-pilates-reformer/Z4F92579021C1CA25613BZ/p/?o=z4f92579021c1ca25613bz-1
2024-12-21 13:07:59,Z51CFFC93511AF6D8ACAEZ,Generic Pilates Yoga Wedge Massage Correction Yoga Foam Kyphosis Correction Detachable Large Spine Yoga Equipment ,Generic,0,0,N,299,269.10,Y,210,/uae-en/pilates-yoga-wedge-massage-correction-yoga-foam-kyphosis-correction-detachable-large-spine-yoga-equipment/Z51CFFC93511AF6D8ACAEZ/p/?o=z51cffc93511af6d8acaez-1
2024-12-21 13:07:59,Z6F4C6B975B77B9D3D8E4Z,Generic Yoga Socks for Women Non Slip Grips & Straps 3 Pairs  Multicolor Dance Pilates Barre Barefoot Workout ,Generic,4.7,21,N,39,27.30,Y,211,/uae-en/yoga-socks-for-women-non-slip-grips-straps-3-pairs-multicolor-dance-pilates-barre-barefoot-workout/Z6F4C6B975B77B9D3D8E4Z/p/?o=z6f4c6b975b77b9d3d8e4z-1
